### ISSUE TITLE
4.87.0 regression: TCP keepalive probes from containers are never answered; keepalive-armed connections die with ETIMEDOUT (macOS)

### ISSUE THREAD

**Issue by dazwin** [docker/desktop-feedback#614]
## Summary

Since Docker Desktop **4.87.0**, keepalive probes sent by a container are forwarded out of the VM correctly but never answered. A keepalive probe is a zero-length `snd_nxt-1` segment, which a TCP endpoint is required to acknowledge (RFC 1122 §4.2.3.6, RFC 9293 §3.8.4). Because nothing answers, the container's own kernel exhausts `TCP_KEEPCNT` and aborts the connection with `ETIMEDOUT`.

The connection is otherwise healthy: data flows normally in both directions, and the host-side leg stays `ESTABLISHED` throughout. Only the probes are dropped.

The practical effect is inverted from what keepalive is for: arming `SO_KEEPALIVE` — normally a way to keep a quiet connection healthy — becomes the thing that kills it. Any container connection that goes quiet for longer than its keepalive idle delay dies, while the same connection with keepalive **disabled** survives indefinitely.

Found via the AWS SDK for JavaScript v3, which enables keepalive by default: every SQS long poll with `WaitTimeSeconds >= 12` began failing at ~11 s while `WaitTimeSeconds: 10` still worked. The reproduction below removes the SDK, Node and libuv from the picture and sets the socket options directly. See **Impact** for why that combination is the loudest case.

**4.86.0 is the last working version.**

## Affected versions

Same machine, same test, bundle swapped in place, all within one session:

| Docker Desktop | Build | VM kernel | Result |
|---|---|---|---|
| 4.86.0 | 236216 | 6.12.76-linuxkit | **PASS** — survives 40 s of silence |
| 4.87.0 | 236836 | 7.0.12-linuxkit | **FAIL** — `ETIMEDOUT` at 11.2 s |
| 4.88.0 | 237115 | — | **FAIL** — `ETIMEDOUT` at 11.3 s |

Control on every version: the identical test with keepalive **disabled** receives data at ~40.0 s.

## Environment

- macOS 26.5.2, Apple silicon (arm64)
- Docker Engine 29.7.2 (identical binary across all three Desktop versions)
- `NetworkType = gvisor` (unchanged on this machine since at least Dec 2023 — the update did not switch network stacks)
- `UseVirtualizationFramework = False` (Docker VMM)
- No system proxy (`scutil --proxy` clean), no macOS network system extensions

## Reproduction

One Dockerfile and two commands. No credentials, no external services, no SDK — the far end is a listener on the Mac itself, and the keepalive options are set explicitly so no runtime or library behavior is assumed.

**`Dockerfile`** (self-contained; the probe is inlined):

```dockerfile
# syntax=docker/dockerfile:1.7
FROM alpine:3.20
RUN apk add --no-cache python3

COPY <<'PROBE' /probe.py
"""Connect to a silent listener, arm SO_KEEPALIVE, then stay quiet.

A compliant path ACKs each keepalive probe and the connection survives.
If probes go unanswered the local kernel aborts the socket with ETIMEDOUT.

usage: probe.py <host> <port> [TCP_KEEPIDLE seconds] [seconds to stay silent]
"""
import errno, socket, sys, time

host = sys.argv[1]
port = int(sys.argv[2])
idle = int(sys.argv[3]) if len(sys.argv) > 3 else 1
wait = int(sys.argv[4]) if len(sys.argv) > 4 else 40

s = socket.create_connection((host, port), timeout=10)
s.setsockopt(socket.SOL_SOCKET,  socket.SO_KEEPALIVE,  1)
s.setsockopt(socket.IPPROTO_TCP, socket.TCP_KEEPIDLE,  idle)
s.setsockopt(socket.IPPROTO_TCP, socket.TCP_KEEPINTVL, 1)
s.setsockopt(socket.IPPROTO_TCP, socket.TCP_KEEPCNT,   10)
print("connected to %s:%d - SO_KEEPALIVE=%d KEEPIDLE=%d KEEPINTVL=%d KEEPCNT=%d" % (
    host, port,
    s.getsockopt(socket.SOL_SOCKET,  socket.SO_KEEPALIVE),
    s.getsockopt(socket.IPPROTO_TCP, socket.TCP_KEEPIDLE),
    s.getsockopt(socket.IPPROTO_TCP, socket.TCP_KEEPINTVL),
    s.getsockopt(socket.IPPROTO_TCP, socket.TCP_KEEPCNT)), flush=True)

s.settimeout(wait)
t = time.time()
try:
    n = len(s.recv(1024))
    print(f"PASS: peer sent {n} bytes after {time.time()-t:.1f}s - connection survived")
except OSError as e:
    # NB: socket.timeout IS TimeoutError in py>=3.10, and ETIMEDOUT also raises
    # TimeoutError - they must be told apart by errno, not by exception type.
    el = time.time() - t
    if e.errno == errno.ETIMEDOUT:
        print(f"FAIL: connection aborted (ETIMEDOUT) after {el:.1f}s - keepalive probes went unanswered")
        sys.exit(1)
    if e.errno is None:
        print(f"PASS: still connected after {el:.1f}s of silence")
        sys.exit(0)
    print(f"FAIL: {e.__class__.__name__} errno={e.errno} after {el:.1f}s")
    sys.exit(1)
PROBE

ENTRYPOINT ["python3", "-u", "/probe.py"]
```

**Run it.** On the macOS host, start a listener that accepts and stays silent, then run the probe:

```console
$ (sleep 3600 | nc -l 9977) &          # any silent listener will do
$ docker build -t keepalive-probe .
$ docker run --rm keepalive-probe host.docker.internal 9977 1 40
```

Results:

```
# 4.87.0 and 4.88.0
connected to host.docker.internal:9977 - SO_KEEPALIVE=1 KEEPIDLE=1 KEEPINTVL=1 KEEPCNT=10
FAIL: connection aborted (ETIMEDOUT) after 11.2s - keepalive probes went unanswered

# 4.86.0
connected to host.docker.internal:9977 - SO_KEEPALIVE=1 KEEPIDLE=1 KEEPINTVL=1 KEEPCNT=10
PASS: still connected after 40.0s of silence
```

The same failure occurs with `--network host`, on the default bridge and on user-defined bridges, and against external destinations (originally found against `sqs.us-east-1.amazonaws.com`). It does **not** occur container-to-container on the same bridge, where the peer container's kernel answers the probes normally.

## The probe leaves the VM correctly — the host side never answers

`tcpdump -i any` **inside the VM's network namespace** (`docker run --privileged --network host`) during a failing run. Each probe is visible on all three hops — container veth, `docker0`, then SNAT'd out of `eth0` as `192.168.65.3` — and nothing ever comes back:

```
vethf4609d0 P   IP 172.17.0.3.46602   > 192.168.65.254.9977: Flags [.], ack 1, length 0
docker0     In  IP 172.17.0.3.46602   > 192.168.65.254.9977: Flags [.], ack 1, length 0
eth0        Out IP 192.168.65.3.46602 > 192.168.65.254.9977: Flags [.], ack 1, length 0     <- leaves the VM
   ... repeats every ~1.02 s, no inbound packet at any hop ...
vethf4609d0 P   IP 172.17.0.3.46602   > 192.168.65.254.9977: Flags [R.], seq 1, ack 1       <- container kernel gives up
```

So the VM kernel, bridge and NAT all handle the probe correctly. The packet reaches the host-side network stack, which does not reply. Note that 4.87.0 also ships a new VM kernel (6.12.76-linuxkit → 7.0.12-linuxkit, see [docker/desktop-feedback#602](https://github.com/docker/desktop-feedback/issues/602)) — this trace rules the kernel out as the location of the drop, though the change arrived in the same release.

For contrast, the same capture point on **4.86.0**, where every probe is answered within ~200 µs:

```
Out IP 172.17.0.2.59774 > 192.168.65.254.9977: Flags [.], ack 1, win 512,  length 0
In  IP 192.168.65.254.9977 > 172.17.0.2.59774: Flags [.], ack 1, win 4093, length 0   +0.000174s
Out IP 172.17.0.2.59774 > 192.168.65.254.9977: Flags [.], ack 1, win 512,  length 0
In  IP 192.168.65.254.9977 > 172.17.0.2.59774: Flags [.], ack 1, win 4093, length 0   +0.000266s
```

## Where the connection terminates

This is split TCP, not packet forwarding — `com.docker.backend` terminates the container's connection and opens a separate one onward, so from the container's point of view Docker Desktop *is* the peer, and is the party that owes the ACK. `lsof` on the host during a test, showing both legs:

```
Python    59166  ... TCP 127.0.0.1:9977->127.0.0.1:63527 (ESTABLISHED)   <- listener's leg
com.docke 60827  ... TCP 127.0.0.1:63527->127.0.0.1:9977 (ESTABLISHED)   <- Docker's leg
```

Confirming the far end is unaffected: after the container-side socket is reset at ~11 s, the host-side leg remains `ESTABLISHED` and a later `send()` from the listener succeeds into the proxy.

## The connection is alive — only probes are dropped

A discriminator run: same 1 s keepalive, plus one data byte written at t=3 s. The data byte was ACKed in **190 µs**; that ACK reset the keepalive idle timer; probes resumed and went unanswered; death moved from 11.27 s to **14,260 ms** = 3 s + 1 s idle + 10 × 1 s.

This rules out an idle-connection reaper, MTU (probes are zero-length), IPv6, and host firewall interference. The path is responsive to data at sub-millisecond latency while silently discarding the zero-length probe.

## Death time tracks the keepalive idle delay

| `TCP_KEEPIDLE` | Outcome |
|---|---|
| 1 s | `ETIMEDOUT` at 11.3 s |
| 5 s | `ETIMEDOUT` at 15.6 s |
| 20 s | `ETIMEDOUT` at 30.4 s |
| disabled | survives (data at 40.0 s) |

Consistent with idle delay + `TCP_KEEPCNT` × `TCP_KEEPINTVL`.

## Impact

Any container connection crossing the VM boundary with `SO_KEEPALIVE` armed that goes silent for longer than its idle delay.

**Node.js applications are hit hardest and fastest.** libuv hardcodes `TCP_KEEPINTVL=1` and `TCP_KEEPCNT=10` alongside whatever idle delay is requested, so a socket dies ~11 s after it goes quiet. The AWS SDK v3 for JavaScript enables keepalive by default and does not set `keepAliveMsecs`, so Node's 1000 ms default applies and is pushed onto the in-flight socket by `@smithy/node-http-handler`. The practical result: **every SQS long poll with `WaitTimeSeconds >= 12` fails**, while `WaitTimeSeconds: 10` succeeds. That silently breaks SQS consumers developed against real AWS, and it took a packet capture to attribute — the surfaced error is a bare `read ETIMEDOUT`, which points at the network or at AWS rather than at the local Docker installation.

Applications using stock Linux keepalive tuning (75 s × 9) hit the same defect but take ~11 minutes to fail, which is far harder to attribute and may be circulating unrecognised.

Container-to-container traffic on the same bridge is unaffected, as it never leaves the VM.

## Workarounds

- Downgrade to 4.86.0 (`https://desktop.docker.com/mac/main/arm64/236216/Docker.dmg`). Volumes, images and containers all survived the downgrade intact.
- Disable keepalive in the affected client, or raise its idle delay above the longest expected silence. Both are unsatisfactory: they alter production behavior to work around a developer-machine defect, and the latter only moves the cliff.

## Expected behavior

Docker Desktop's host-side network stack should reply to a zero-length keepalive probe with a duplicate ACK, as it did through 4.86.0 and as any compliant TCP endpoint does.

### Platform

macOS

### Version information

```bash
Client:
 Version:           29.7.2
 API version:       1.55
 Go version:        go1.26.5
 Git commit:        a7dcaa6
 Built:             Wed Aug  5 18:27:50 2026
 OS/Arch:           darwin/arm64
 Context:           desktop-linux

Server: Docker Desktop 4.86.0 (236216)
 Engine:
  Version:          29.7.2
  API version:      1.55 (minimum version 1.40)
  Go version:       go1.26.5
  Git commit:       6a43e3d
  Built:            Wed Aug  5 18:28:35 2026
  OS/Arch:          linux/arm64
  Experimental:     false
 containerd:
  Version:          v2.2.5
  GitCommit:        e53c7c1516c3b2bff98eb76f1f4117477e6f4e66
 runc:
  Version:          1.3.6
  GitCommit:        v1.3.6-0-g491b69ba
 docker-init:
  Version:          0.19.0
  GitCommit:        de40ad0

Server:
 Containers: 9
  Running: 7
  Paused: 0
  Stopped: 2
 Images: 99
 Server Version: 29.7.2
 Storage Driver: overlay2
  Backing Filesystem: extfs
  Supports d_type: true
  Using metacopy: false
  Native Overlay Diff: true
  userxattr: false
 Logging Driver: json-file
 Cgroup Driver: cgroupfs
 Cgroup Version: 2
 Plugins:
  Volume: local
  Network: bridge host ipvlan macvlan null overlay
  Log: awslogs fluentd gcplogs gelf journald json-file local splunk syslog
 CDI spec directories:
  /etc/cdi
  /var/run/cdi
 Discovered Devices:
  cdi: docker.com/gpu=webgpu
 Swarm: inactive
 Runtimes: io.containerd.runc.v2 runc
 Default Runtime: runc
 Init Binary: docker-init
 containerd version: e53c7c1516c3b2bff98eb76f1f4117477e6f4e66
 runc version: v1.3.6-0-g491b69ba
 init version: de40ad0
 Security Options:
  seccomp
   Profile: builtin
  cgroupns
 Kernel Version: 6.12.76-linuxkit
 Operating System: Docker Desktop
 OSType: linux
 Architecture: aarch64
 CPUs: 10
 Total Memory: 15.6GiB
 Name: docker-desktop
 ID: 25738340-ecbd-4e36-8bd6-104062ed1602
 Docker Root Dir: /var/lib/docker
 Debug Mode: false
 HTTP Proxy: http.docker.internal:3128
 HTTPS Proxy: http.docker.internal:3128
 No Proxy: hubproxy.docker.internal
 Labels:
 Experimental: false
 Insecure Registries:
  hubproxy.docker.internal:5555
  ::1/128
  127.0.0.0/8
 Live Restore Enabled: false
 Firewall Backend: iptables
```

The machine is currently pinned to 4.86.0 (the last working version) after the downgrade A/B above — the failing versions are 4.87.0 (build 236836) and 4.88.0 (build 237115), same Engine 29.7.2 on all three.

### Diagnostics ID

Not generated — happy to run diagnostics on 4.88.0 on request.

**Comment by bsousaa** [comment]
Can you please share a diagnostics id?

**Comment by dazwin** [comment]
Diagnostics ID: `01246107-1165-4446-AF27-B97B94BE565D/20260825133346`

Captured on **4.88.0 (build 237115)**, VM kernel 7.0.12-linuxkit, with a fresh reproduction immediately before gathering — the failing run is at **2026-08-25 13:33:29–13:33:41 UTC**:

```
connected to host.docker.internal:9977 - SO_KEEPALIVE=1 KEEPIDLE=1 KEEPINTVL=1 KEEPCNT=10
FAIL: connection aborted (ETIMEDOUT) after 11.3s - keepalive probes went unanswered
```

No other containers were running during the capture, and I rotated the historical Docker logs away beforehand, so the bundle covers only this session and the one failing run rather than years of unrelated history.

Happy to also capture a bundle on 4.86.0 (build 236216) for a side-by-side if that helps — that's the last version where the probes are answered.

**Comment by bsousaa** [comment]
Thank you, we have a fix in progress
